{
  "schemaVersion": "2000m.v2.campaign.v1",
  "campaignId": "paired-private-pilot-v1",
  "title": "Paired private pilot: naked model baseline vs Open Scaffold ledger/analyze lane",
  "status": "draft",
  "hypothesis": "Under equal model/runtime/budget conditions, Open Scaffold's work-record/evolve loop produces more recoverable, visually coherent, and improvement-directed game artifacts than a naked model loop.",
  "freezeRules": {
    "freezeBeforeLiveResults": true,
    "noScorerMutationAfterLiveResults": true,
    "calibrationMutationPolicy": "If scenario, scorer, visual rubric, capture seeds, lane rules, or decision rules change after any live result is inspected, affected runs are calibration only and cannot support proof claims.",
    "frozenRefs": {
      "scenario": "v2/examples/workflow-resilience-pilot.scenario.json",
      "scorer": "v2/conformance/src/main.rs",
      "visualTrack": "v2/VISUAL_ARTIFACT_TRACK.md",
      "decisionRules": "v2/EXPERIMENT_PROTOCOL.md#predeclared-decision-rules"
    }
  },
  "controls": {
    "model": "codex-gpt5.5",
    "runtime": "same Codex runtime for all enabled lanes",
    "generationCap": 3,
    "scorerFeedbackBudget": 1,
    "reviewerFeedbackBudget": 1,
    "contextWipePhase": "after first scored generation and before final recommendation",
    "samePromptBudget": true,
    "sameFeedbackPackets": true,
    "wallClockPolicy": "diagnostic-only"
  },
  "lanes": [
    {
      "laneId": "A",
      "label": "Naked model baseline",
      "role": "naked-model-baseline",
      "enabled": true,
      "controllerStatus": "not-applicable",
      "allowedTools": [
        "same model/runtime",
        "build/test/score commands",
        "plain trajectory.json",
        "plain scorer-feedback packet"
      ],
      "forbiddenAdvantages": [
        "Open Scaffold plans or .osc state",
        "osc evolve analyze",
        "compact evidence generated by Open Scaffold",
        "extra human-written repair hints unavailable to Lane B"
      ],
      "requiredEvidence": [
        "prompt transcript",
        "generation outputs",
        "build logs",
        "v1 conformance JSON",
        "v2 run record",
        "visual artifact package"
      ]
    },
    {
      "laneId": "B",
      "label": "Open Scaffold ledger/analyze lane",
      "role": "open-scaffold-ledger-analyze",
      "enabled": true,
      "controllerStatus": "not-applicable",
      "allowedTools": [
        "same model/runtime",
        "Open Scaffold active plan",
        "run packets",
        "scorer import/evaluation envelope",
        "osc evolve analyze",
        "compact evidence",
        "explicit continue/stop/redesign/inspect-scorer recommendation"
      ],
      "forbiddenAdvantages": [
        "different model/runtime",
        "extra scorer feedback",
        "extra generation budget",
        "claiming controller behavior without a controller"
      ],
      "requiredEvidence": [
        "active/done plan refs",
        "run packets",
        "evaluation records",
        "evolve analysis output",
        "compact evidence",
        "v1 conformance JSON",
        "v2 run record",
        "visual artifact package"
      ]
    },
    {
      "laneId": "C",
      "label": "Controller lane",
      "role": "controller",
      "enabled": false,
      "controllerStatus": "not-implemented",
      "allowedTools": [],
      "forbiddenAdvantages": [
        "pretending a controller lane exists before implementation",
        "mixing controller claims into Lane B ledger/analyze results"
      ],
      "requiredEvidence": []
    }
  ],
  "pairs": [
    {
      "pairId": "pilot-seed-101",
      "taskSeed": 101,
      "scenario": "v2/examples/workflow-resilience-pilot.scenario.json",
      "enabledLanes": ["A", "B"],
      "notes": "First paired seed for private pilot. Do not publish as proof."
    },
    {
      "pairId": "pilot-seed-202",
      "taskSeed": 202,
      "scenario": "v2/examples/workflow-resilience-pilot.scenario.json",
      "enabledLanes": ["A", "B"],
      "notes": "Second paired seed for private pilot."
    },
    {
      "pairId": "pilot-seed-303",
      "taskSeed": 303,
      "scenario": "v2/examples/workflow-resilience-pilot.scenario.json",
      "enabledLanes": ["A", "B"],
      "notes": "Third paired seed for private pilot."
    }
  ],
  "visualTrack": {
    "enabled": true,
    "specRef": "v2/VISUAL_ARTIFACT_TRACK.md",
    "fixedSeeds": [1101, 2202, 3303],
    "requiredArtifacts": [
      "screenshot",
      "gif",
      "replay-log",
      "frame-metadata",
      "rubric-record",
      "blind-label-map"
    ],
    "captureWindows": [
      "early-game fixed tick window",
      "mid-run obstacle field window",
      "post-feedback rerun window"
    ],
    "rubricRef": "v2/VISUAL_ARTIFACT_TRACK.md#visual-rubric",
    "blindReview": {
      "anonymized": true,
      "mappingSealedBeforeReview": true,
      "ownerTasteIsNotMechanicalScore": true
    }
  },
  "decisionRules": {
    "predeclared": true,
    "noSupport": "Call no support if Lane B only produces one prettier output, loses/ties without visual or trajectory improvement, or gains from unequal budget/feedback.",
    "directionalSignal": "Call directional signal if Lane B improves one or more evidence tracks but sample size, metric disagreement, or invalid pairs prevent a causal claim.",
    "repeatableSupport": "For a real evidence campaign, require Lane B to match or beat mechanical score, win visual/artifact quality in most valid pairs, waste fewer generations after plateau, and improve fresh-agent recovery without hidden advantages."
  },
  "bannedClaims": [
    "Open Scaffold makes the model smarter.",
    "Open Scaffold won because one output looked cooler.",
    "The old 2000m v1 result proves framework superiority.",
    "Workflow score equals model ranking.",
    "Adoption proof.",
    "Calibration fixtures are public contender results."
  ]
}
